{
  "schema": "issue-pr-reconciliation@1",
  "program": "ES6-ZI-001",
  "exact_start_sha": "e987c892cf0ac04b1bd3b942186754d5fe398d22",
  "generated_at": "2026-08-18T06:32:04Z",
  "items": [
    {
      "kind": "issue",
      "number": 39,
      "title": "Phase 4 follow-up: valid full-schema four-arm superiority run",
      "phase": "evidence-process",
      "disposition": "close-when-evidence",
      "owner": "agent",
      "blocked_by": [],
      "labels": [
        "work:live-verification",
        "gate:live-environment",
        "assurance:R3"
      ],
      "evidence_note": "Four-arm superiority run.",
      "url": "https://github.com/ZMS-Labs/epistemic-skills/issues/39"
    },
    {
      "kind": "issue",
      "number": 40,
      "title": "Release gate: cross-family Step-7b adjudication before any v3 3.0.0",
      "phase": "frontier-decision",
      "disposition": "reconcile-in-matrix",
      "owner": "operator",
      "blocked_by": [],
      "labels": [
        "assurance:R3",
        "gate:external",
        "gate:operator",
        "work:dependency",
        "work:decision"
      ],
      "evidence_note": "Re-scope v3 Step-7b into v6 Gauntlet.",
      "url": "https://github.com/ZMS-Labs/epistemic-skills/issues/40"
    },
    {
      "kind": "issue",
      "number": 77,
      "title": "Behavioral epoch program: convert every BLOCKED/absent battery into dated live-epoch evidence (successor to #70)",
      "phase": "evidence-process",
      "disposition": "close-when-evidence",
      "owner": "agent",
      "blocked_by": [],
      "labels": [
        "work:live-verification",
        "gate:live-environment",
        "assurance:R3"
      ],
      "evidence_note": "Behavioral epoch program.",
      "url": "https://github.com/ZMS-Labs/epistemic-skills/issues/77"
    },
    {
      "kind": "issue",
      "number": 84,
      "title": "Paired proposal (charter step 1): exchange-protocol adoption, v4 event-contract re-pin, and field-pair ownership",
      "phase": "frontier-decision",
      "disposition": "reconcile-in-matrix",
      "owner": "joint",
      "blocked_by": [],
      "labels": [
        "gate:operator",
        "work:dependency",
        "work:decision",
        "assurance:R2"
      ],
      "evidence_note": "Items 1\u20132 done; field-pair supply remains.",
      "url": "https://github.com/ZMS-Labs/epistemic-skills/issues/84"
    },
    {
      "kind": "issue",
      "number": 89,
      "title": "resolve/literature: no auth canary for the discovery engine \u2014 free-tier degradation is silent and grades as clean",
      "phase": "custody-build-packet",
      "disposition": "implement-when-unblocked",
      "owner": "agent",
      "blocked_by": [],
      "labels": [
        "bug",
        "assurance:R1"
      ],
      "evidence_note": "Discovery-engine auth canary missing.",
      "url": "https://github.com/ZMS-Labs/epistemic-skills/issues/89"
    },
    {
      "kind": "issue",
      "number": 95,
      "title": "CI: durable local-cluster fallback, and prefer local CI over Actions minutes",
      "phase": "evidence-process",
      "disposition": "implement-when-unblocked",
      "owner": "agent",
      "blocked_by": [],
      "labels": [
        "assurance:R0",
        "tech-debt"
      ],
      "evidence_note": "Local-cluster CI fallback.",
      "url": "https://github.com/ZMS-Labs/epistemic-skills/issues/95"
    },
    {
      "kind": "issue",
      "number": 104,
      "title": "Complete or explicitly retire the unimplemented v5 design commitments before successor GO",
      "phase": "frontier-decision",
      "disposition": "hold-operator",
      "owner": "operator",
      "blocked_by": [],
      "labels": [
        "gate:operator",
        "work:decision",
        "assurance:R0"
      ],
      "evidence_note": "Implement vs retire v5 design commitments.",
      "url": "https://github.com/ZMS-Labs/epistemic-skills/issues/104"
    },
    {
      "kind": "issue",
      "number": 105,
      "title": "P2: finish v5 public-content remediation and add an exact-candidate review gate",
      "phase": "ES6-ZI-001",
      "disposition": "reconcile-in-matrix",
      "owner": "agent",
      "blocked_by": [],
      "labels": [
        "bug",
        "assurance:R1"
      ],
      "evidence_note": "Exact-candidate public-content gate.",
      "url": "https://github.com/ZMS-Labs/epistemic-skills/issues/105"
    },
    {
      "kind": "issue",
      "number": 118,
      "title": "mission-custody contract@2: bind receipt hashes and a tail anchor into the checkpoint chain",
      "phase": "blocked-parent",
      "disposition": "implement-when-unblocked",
      "owner": "agent",
      "blocked_by": [],
      "labels": [
        "bug",
        "security",
        "assurance:R1"
      ],
      "evidence_note": "contract@2 receipt hash + tail anchor.",
      "url": "https://github.com/ZMS-Labs/epistemic-skills/issues/118"
    },
    {
      "kind": "issue",
      "number": 124,
      "title": "mission-custody: receipt continuity check \u2014 surface unreceipted mutation between receipted events",
      "phase": "blocked-parent",
      "disposition": "implement-when-unblocked",
      "owner": "agent",
      "blocked_by": [],
      "labels": [
        "assurance:R1",
        "work:dependency"
      ],
      "evidence_note": "Receipt continuity check design open.",
      "url": "https://github.com/ZMS-Labs/epistemic-skills/issues/124"
    },
    {
      "kind": "issue",
      "number": 129,
      "title": "custody hook: Antigravity (agy) adapter + install snippet \u2014 coverage currently NOT WIRED",
      "phase": "custody-build-packet",
      "disposition": "implement-when-unblocked",
      "owner": "agent",
      "blocked_by": [],
      "labels": [
        "bug",
        "assurance:R1",
        "work:live-verification",
        "gate:live-environment"
      ],
      "evidence_note": "Antigravity adapter not wired.",
      "url": "https://github.com/ZMS-Labs/epistemic-skills/issues/129"
    },
    {
      "kind": "issue",
      "number": 136,
      "title": "custody hook: Cursor CLI workaround must use an installed plugin-root command",
      "phase": "custody-build-packet",
      "disposition": "implement-when-unblocked",
      "owner": "agent",
      "blocked_by": [],
      "labels": [
        "bug",
        "assurance:R1",
        "work:live-verification",
        "gate:live-environment"
      ],
      "evidence_note": "Cursor CLI hook must use plugin-root path.",
      "url": "https://github.com/ZMS-Labs/epistemic-skills/issues/136"
    },
    {
      "kind": "issue",
      "number": 137,
      "title": "mission-custody Stage-C gate: close three false-allow bypasses and four contract/CLI gaps from PR #128",
      "phase": "custody-build-packet",
      "disposition": "implement-when-unblocked",
      "owner": "agent",
      "blocked_by": [],
      "labels": [
        "bug",
        "security",
        "assurance:R1",
        "source:audit"
      ],
      "evidence_note": "P1 false-allow bypasses from PR #128 review.",
      "url": "https://github.com/ZMS-Labs/epistemic-skills/issues/137"
    },
    {
      "kind": "issue",
      "number": 139,
      "title": "cancel --reason \"\" silently erases the why on a terminal, irreversible verb",
      "phase": "custody-build-packet",
      "disposition": "implement-when-unblocked",
      "owner": "agent",
      "blocked_by": [],
      "labels": [],
      "evidence_note": "Mission-custody residue; deferred past ES6-ZI-001 per #191.",
      "url": "https://github.com/ZMS-Labs/epistemic-skills/issues/139"
    },
    {
      "kind": "issue",
      "number": 140,
      "title": "mission-custody test suite: intermittent flakes on Windows (subprocess/tempdir timing), not code regressions",
      "phase": "custody-build-packet",
      "disposition": "implement-when-unblocked",
      "owner": "agent",
      "blocked_by": [],
      "labels": [],
      "evidence_note": "Mission-custody residue; deferred past ES6-ZI-001 per #191.",
      "url": "https://github.com/ZMS-Labs/epistemic-skills/issues/140"
    },
    {
      "kind": "issue",
      "number": 141,
      "title": "custody_gate: path_globs matched against an unscoped file_path can false-block an unrelated workspace",
      "phase": "custody-build-packet",
      "disposition": "implement-when-unblocked",
      "owner": "agent",
      "blocked_by": [],
      "labels": [],
      "evidence_note": "Mission-custody residue; deferred past ES6-ZI-001 per #191.",
      "url": "https://github.com/ZMS-Labs/epistemic-skills/issues/141"
    },
    {
      "kind": "issue",
      "number": 142,
      "title": "Capture real harness hook payloads \u2014 two guard types now rest on docs prose, not observed wire format",
      "phase": "custody-build-packet",
      "disposition": "implement-when-unblocked",
      "owner": "agent",
      "blocked_by": [],
      "labels": [],
      "evidence_note": "Capture real harness hook payloads.",
      "url": "https://github.com/ZMS-Labs/epistemic-skills/issues/142"
    },
    {
      "kind": "issue",
      "number": 145,
      "title": "test fixtures carry a real operator name form into a public repo, and it is spreading",
      "phase": "custody-build-packet",
      "disposition": "implement-when-unblocked",
      "owner": "agent",
      "blocked_by": [],
      "labels": [],
      "evidence_note": "Synthetic fixture operator names spreading.",
      "url": "https://github.com/ZMS-Labs/epistemic-skills/issues/145"
    },
    {
      "kind": "issue",
      "number": 147,
      "title": "mission-custody: record the RESOLVED artifact path at write time (scope classification is lexical)",
      "phase": "custody-build-packet",
      "disposition": "implement-when-unblocked",
      "owner": "agent",
      "blocked_by": [],
      "labels": [],
      "evidence_note": "Mission-custody residue; deferred past ES6-ZI-001 per #191.",
      "url": "https://github.com/ZMS-Labs/epistemic-skills/issues/147"
    },